{
  "blueprint_id": "bp-basic-planner",
  "display_name": "Basic Planner Agent Blueprint",
  "description": "Vendor-neutral DID-first template for planner agents.",
  "publisher": "Didone World",
  "verified_publisher": true,
  "publisher_domain": "didone.world",
  "sign_in_audience": "single_tenant",
  "identifier_uris": ["api://didone.world/agents/planner"],
  "app_roles": [{"value": "Planner.Execute", "description": "Run planning tasks"}],
  "optional_claims": {"id_token": ["did", "agent_id"]},
  "group_membership_claims": ["security_group"],
  "token_encryption_key_id": null,
  "certification": {"profile": "agent-did-blueprint-v1"},
  "info_urls": {"marketing": "https://didone.world/agents", "support": "https://didone.world/support", "terms_of_service": "https://didone.world/terms", "privacy": "https://didone.world/privacy"},
  "tags": ["did", "a2a", "vendor-neutral"],
  "status": "active",
  "permissions": {"required_resource_access": [], "inheritable_permissions": [], "consent_grants": [], "direct_agent_grants": [], "denied_permissions": []},
  "owners": ["user:agent-platform-owner"],
  "sponsors": ["group:automation-sponsors"],
  "extension_fields": {"alignment_profile": "microsoft-entra-agent-id"},
  "created_at": "2026-05-04T00:00:00Z",
  "updated_at": "2026-05-04T00:00:00Z"
}
